;prot_id;template_code;date_of_lesson;org_id;teacher_id;observer_id;curator_id;class;satisfaction;wish_to_change;pupils_all;pupils_strong;pupils_middle;pupils_weak;interactions_all;interactions_strong;interactions_middle;interactions_weak;attention_all;attention_strong;attention_middle;attention_weak;teacher_comments
196;2082;П1.2;21.09.2022;92;585;586;584;0;0;0;8;3;3;2;;7;3;6;;3;3;2;Работой на уроке обучающимися удовлетворена. Продолжить работу в даном направлении.
197;2124;П1.2;21.09.2022;111;797;798;790;0;0;0;20;4;9;7;;7;13;17;;4;6;6;Уроком удовлетворена. Пожелание - уделять побольше внимания не только слабым и средним ребятам, но и  сильным.
198;2153;П1.2;21.09.2022;107;695;697;696;7;4;1;0;1;3;3;;3;7;8;;1;3;3;Да, удовлетворена. Но необходимо обратить внимание на средних учащихся и попытаться вывести их в сильную группу
199;1962;П1.2;21.09.2022;127;928;929;927;2;4;1;0;1;2;0;;16;27;0;;1;2;0;Уроком удовлетворена. Внимание распределено между всеми группами учащихся. Сильный учащийся на уроке был задействован чаще.Средняя группа учащихся не испытывала дефицита внимания, но на последующих уроках планирую вовлекать их в работу чаще.
200;1747;П1.2;21.09.2022;97;628;629;627;11;3;4;4;2;1;1;;14;11;9;;2;1;1;Удовлетворена в целом, но  понимаю , что слабым ученикам  нужно уделять больше внимания, хотя и сильных на уроке нужно нагружать, чтобы развивались. Я старалась всех в классе  не оставить без внимания и работы, поэтому все были активны в свою меру меру энергичности и активности. Сильные желали отвечать сами, средних и слабых  побуждать к ответу приходилось мне.
201;2080;П1.2;21.09.2022;96;625;624;623;2;4;1;5;2;2;1;;3;2;3;;2;2;1;Да. Меня всё устраивает. Внимание распределено в течении урока равномерно, как сильным,так и слабым ученикам.
202;2169;П1.2;21.09.2022;80;546;547;542;0;0;0;10;5;1;4;;8;1;5;;5;1;4;Желая получить быстрый и верный ответ, обращалась к сильным учениекам. Надо престроить работу: пусть сильные обращаются к слабым. Так бдет полезнее и тем, и другим.
203;1739;П1.2;21.09.2022;73;482;481;480;0;0;0;7;2;2;3;;4;11;6;;2;2;3;В целом я удовлетворена уроком. Учитель взаимодействовал со всеми учениками. Общение складывалось взаимное с сильными и средними учениками. От слабых с трудом приходилось вытягивать ответ на вопрос, но они старательно пытались ответить, хоть и не всегда правильно. Хотелось бы поставить цель так, чтобы более слабые еще с большей активностью работали на уроке.
204;1740;П1.2;21.09.2022;73;481;482;480;0;0;0;7;2;3;2;;14;8;6;;2;3;2;Я не совсем удовлетворена уроком. На мой взгляд  учитель работал со всеми учениками, но в большей степени отвечали на вопросы и взаимодействовали с учителем более сильные ученики. Учитель взаимодействовал со средними и слабыми учениками, но общение сложилось одностороннее. Хотелось бы , чтобы общение сложилось с обеих сторон.
205;1814;П1.2;22.09.2022;123;839;838;837;9;3;2;0;2;3;3;;15;14;11;;2;3;3;Уроком удовлетворена. Но хотелось бы обращать внимание больше на слабых учеников.
206;1895;П1.2;22.09.2022;132;721;719;720;0;0;0;2;0;2;0;;0;15;0;;0;2;0;Результатами по данному протоколу доволен, распределение моего внимания было правильным. Наверно, трудно получить другой результат с таким малым количеством детей. Но я считаю, что это хорошая тренировка данного навыка для работы в классах с большим количеством учеников.
207;2052;П1.2;22.09.2022;102;657;656;658;0;0;0;2;0;2;0;;0;17;0;;0;2;0;Результатом полностью удовлетворена.Хоть в классе и мало учеников, но работа получилась плодотворная.Дети чувствовали на уроке себя более раскованно. Внимания хватало всем и даже больше. Под конец крока устали и немного темп урока спал. Поэтому пришлось работать всем вместе.
208;1944;П1.2;22.09.2022;84;565;566;564;2;4;1;4;2;0;2;;5;0;5;;2;0;2;Да. Меня всё устраивает. Внимание распределено в течении урока равномерно, как сильным,так и слабым ученикам.
209;1844;П1.2;23.09.2022;133;725;728;727;0;0;0;2;0;1;1;;15;15;0;;0;1;1;Учитель продолжает работать с девочками. На второй встрече девочки стали активнее, задают вопросы, отвечают. Подумываем использовать в работе новые методы, технологии.
210;2151;П1.2;23.09.2022;107;697;695;696;7;2;4;0;1;3;3;;6;34;22;;1;3;3;Уроком не удовлетворена в том, плане, что урок получился не таким, как планировался, так как при актуализации знаний  оказалось, что дети плохо помнят материал предыдущих лет и пришлось немного перестроить урок. В части распределения внимания- удовлетворенность есть в том, что все охвачены вниманием, но группа средних учащихся получает внимания все равно больше, хотя на уроказ стараюсь контролировать себя и отменила правило поднятой руки.
211;1947;П1.2;23.09.2022;125;844;845;840;6;3;2;0;3;7;4;;11;18;16;;3;7;4;Уроком удовлетворена. Проводя урок старалась взаимодействовать с каждым обучающимся по теме урока, повышая качество взаимодействия. 
212;1955;П1.2;23.09.2022;124;914;915;913;7;3;2;0;0;3;3;;0;25;23;;0;3;3;Внимание на дисциплину не акцентировала, дисциплина на уроке хорошая, ребята работали на местах и у доски. Взаимодействие было вербальным и невербальным.Дети хорошо понимают по мимике, жестам реакцию учителя, корректируют ответы. Внимание на две группы учеников распределены равномерно, по мере необходимости. На мой взгляд менять ничего не нужно.
213;1959;П1.2;23.09.2022;124;915;914;913;7;4;1;0;0;1;5;;0;8;34;;0;1;5;Укором полностью удовлетворена
214;2110;П1.2;23.09.2022;88;573;938;572;0;0;0;5;1;2;2;;2;5;5;;1;2;2;(заполняет учитель, который провел урок)                                  
215;2113;П1.2;23.09.2022;88;938;573;572;0;0;0;4;2;1;1;;9;6;5;;2;1;1;Работой детей и своей работой на уроке удовлетворена. Организовала на уроке работу в парах сменного состава, учащихся всех категорий были активны на протяжении всего урока.
216;1948;П1.2;23.09.2022;125;845;844;840;6;3;2;0;4;7;3;;9;15;6;;4;7;3;Пройдя всего два протокола в прошлом году(базовый и усложненный). Поэтому старалась спланировать свою деятельность так, чтобы каждый ребенок был задействован и было взаимодействие со мной и не один раз. Сравнивая после с предыдущими протоколами, больше взаимодействий.
217;1735;П1.2;23.09.2022;71;473;474;471;8;4;2;0;2;2;3;;8;10;12;;2;2;3;Уроком удовлетворена. Внимание распределяла на всех. Больше обращала внимание на слабых. Учащиеся, которые пытались раньше отсиживаться на этом уроке работали активно. Мишень на уроке присутствовала только одна (дети болеют), работала активно. Цель: данной компетенцией, думаю, овладела  желание отработать новые виды протоколов, которые не затрагивали в прошлом учебном году.
218;2060;П1.2;24.09.2022;90;637;636;635;0;3;2;0;1;2;3;;7;17;28;;1;2;3;учитель взаимодействует с учениками только по содержанию урока. Если учитель делает замечание, то только по темпу работы. Урококм удовлетворена, работой охвачены все учащиеся
219;1819;П1.2;26.09.2022;128;732;733;731;0;0;0;8;2;3;3;;6;9;11;;2;3;3;Считаю, что грамотное распределение внимания учителя на уроке позволит создать ситуацию включенности в деятельность всех учащихся, создаст у  учащися из слабой группы ситуацию комфорта на уроке, и может даже, успеха.
220;2118;П1.2;26.09.2022;111;796;802;792;0;4;0;16;5;7;4;;0;0;0;;5;7;4;Результат удовлетворительный. Вниманием были охвачены все дети. Мало ответов было у слабых учащихся. На следующем уроке это нужно будет исправить.
221;2121;П1.2;26.09.2022;111;802;795;792;0;3;0;14;4;7;3;;0;0;0;;4;5;2;Следует уделить внимание средним и слабым учащимся.
222;2125;П1.2;26.09.2022;111;795;802;792;0;3;0;23;6;12;5;;0;0;0;;6;12;4;Следует уделить внимание слабым учащимся.
223;2131;П1.2;26.09.2022;91;641;645;639;0;0;0;3;1;1;1;;12;7;3;;1;1;1;Вцелом уроком довольна.  В классе ребенок с ОВЗ, который оцень слабо учится.  Цель:  уделять больше внимания слабым ученикам.
224;2133;П1.2;26.09.2022;91;645;641;639;0;0;0;3;0;3;0;;0;17;0;;0;3;0;Уроком довольна.Дети только начинают изучать новый предмет - историю. Цель:  привить любовь к предмету через усиление внимания к каждому ученику со стороны учителя
225;2163;П1.2;26.09.2022;123;835;836;834;1;3;2;0;4;3;3;;14;6;9;;4;3;3;Уроком удовлетворена. Больше бы  хотелось  обращать внимание  на слабых учеников.
226;1914;П1.2;26.09.2022;108;708;707;706;0;0;0;21;5;10;6;;2;9;5;;2;7;4;Приоритет уделялся больше средней группе учащихся, слабых учеников опрашивали, но давали мало времени на ответ.
227;1868;П1.2;26.09.2022;119;862;861;860;0;0;0;23;1;12;10;;3;24;7;;1;12;6;"Уроком удовлетворена.  На уроках необходимо стараться уделять время всем ученикам. Чуть больше времени уделять тем ученикам, которые находятся в категории ""слабые"""
228;1969;П1.2;27.09.2022;77;505;506;504;0;0;0;12;2;6;4;;4;5;6;;2;5;3;Удовлетворена. Увеличить взаимодействие со средними и слабыми учащимися. Думаю над этим.
229;1968;П1.2;27.09.2022;77;505;506;504;0;0;0;12;2;6;4;;4;5;6;;2;5;3;Удовлетворена. Увеличить взаимодействие со средними и слабыми учащимися. Думаю над этим.
230;1869;П1.2;28.09.2022;119;861;862;860;0;0;0;23;3;14;6;;7;13;8;;3;7;5;Уроком довольна. Большинство детей вовлечены в работу. Стоит поработать с мотивацией учеников.
231;1870;П1.2;28.09.2022;119;858;857;944;0;0;0;11;6;3;2;;0;0;0;;4;3;2;
232;1875;П1.2;28.09.2022;130;766;765;764;7;3;3;0;0;2;1;;0;4;2;;0;2;1;Класс средний, урок прошел как всегда, я удовлетворена. 
233;1967;П1.2;28.09.2022;77;506;505;504;0;0;0;7;1;5;1;;2;16;1;;1;4;1;Удовлетворена. Увеличить взаимодействие с сильными учащимися. Попробую рабочий лист урока индивидуально
234;1843;П1.2;29.09.2022;133;728;725;727;0;0;0;9;0;9;0;;0;45;0;;0;9;0;Для Екатерины Михайловны тоже использовали протокол 1-2. Хотели посмотреть, что из этого получится. Ещё трудно судить о чём -либо. Нужно узнать какие дети. Поэтому всех детей пока отнесли к категории средних. 
235;1864;П1.2;29.09.2022;119;856;855;854;0;0;0;14;0;11;3;;0;18;2;;0;8;1;К сожалению, не все учащиеся вовлечены в учебную деятельность, особенно слабенькие дети.  Двое ребят активно работали на уроке, задавали вопросы, уточняли выполнение задания
236;2166;П1.2;29.09.2022;123;835;836;834;1;3;2;0;3;6;0;;11;12;0;;3;6;0;Уроком  полностью удовлетворена. 
237;1953;П1.2;29.09.2022;125;841;842;843;0;4;2;0;6;5;5;;24;8;4;;6;4;4;Уроком довольна. Но хотелось бы, чтобы в урок включались и слабые обучающиеся
238;2023;П1.2;29.09.2022;68;512;955;509;0;0;0;24;1;11;12;;4;37;25;;1;11;12;"В зависимости от темы и этапов урока учитель обращает внимание на детей где-то в большей,где-то в меньшей степени.Дети ""посильнее""схватывают быстрее,уже начинают выполнять.Кому-то надо повторить,а то и написать на доске.Бывает,отвлекутся,снова переспрашивают.Тогда внимание переключается на ""слабых"" детей, и ""сильные""заскучали.Мне кажется,можно дать дифференцированные задания,тогда все будут заняты своим делом."
239;2024;П1.2;29.09.2022;68;955;512;509;0;0;0;19;0;4;15;;0;24;76;;0;4;14;Удовлетворена. Обратить свнимание на очень слабых учеников в классе, одна девочка осталась не заеченной.Цель: распределить внимание на всех учеников в классе, не зависимо, какой ученик: слабый, или сильный.
240;2106;П1.2;29.09.2022;86;590;589;588;0;0;0;14;5;7;2;;22;20;2;;5;7;2;Удовлетворена. В классе есть дети ОВЗ.Применила различные  виды деятельности. Цель :повысить качество внимания к каждому ученику, посредством внимательного отношения.
241;1872;П1.2;30.09.2022;119;855;856;854;0;0;0;10;3;2;5;;8;8;20;;3;2;5;Уроком удовлетворена, дети выполнили задания.
242;2168;П1.2;30.09.2022;80;547;546;542;0;0;0;8;5;1;2;;27;8;9;;5;1;2;Не довольна собой, так больше внимания уделила сильным детям. В следующий раз буду внимательнее к слабым и соедним ученикам.
243;2070;П1.2;04.10.2022;89;610;611;612;0;0;0;2;1;1;0;;24;21;0;;1;1;0;"Удовлетворена. На уроке использовала следующие приемы ""Ответ хором"", ""Опрос по цепочке"", ""Как это можно сделать?""  Цель: применить приём ""Холодный обзвон"", ""Слепой жребий"" в других классах где больше учащихся."
244;2072;П1.2;04.10.2022;89;611;610;612;0;0;0;4;1;1;2;;24;12;26;;1;1;2;Уроком удовлетворена. Достижимая цель- на уроке работают все. Применять изученные  методы и приёмы при работе с детьми  1 класса.
245;1984;П1.2;05.10.2022;112;785;786;934;0;4;0;30;7;13;10;;28;33;10;;7;10;4;удовлетворена. Но следует больше спрашивать слабых учеников, вовлекать в учебную деятельность. 
246;1985;П1.2;05.10.2022;112;786;785;934;0;4;0;15;3;3;7;;31;18;10;;3;3;7;удовлетворена. Необходимо работать над методологией опроса слабых учеников.
247;2479;П1.2;07.10.2022;86;590;589;588;5;4;1;15;5;7;3;;4;7;7;;4;5;2;Частично удовлетворен. Учитель взаимодействовал со всеми учениками. Работал пости весь класс. Не проявили интерес к уроку некоторые учащиеся.Ставим перед собой цель ,как исправить эту ситуацию.
248;2286;П1.2;12.10.2022;68;514;515;513;0;0;0;21;4;9;8;;9;12;13;;3;7;7;В целом, удовлетворена,т.к. все группы обучающихся были охвачены достаточно равномерно. Но несколько обучающихся все-таки не были опрошены в полной мере, т.к. на уроке было запланировано много фронтальной работы. Цель- 100% охват, значит нужно сочетать как можно больше форм взаимодействия на уроке.
249;2608;П1.2;13.10.2022;112;787;937;780;4;4;2;0;13;13;6;;32;20;7;;11;10;4;"Я уроком удовлетворена, тк дети отвечали почти все ребята. Много сделали на уроке. Старались проявить себя. Особенно удалась игра ""кто больше назовет""."
250;2315;П1.2;13.10.2022;128;741;736;734;0;3;1;8;4;3;1;;16;12;2;;4;3;1;Уроком удовлетворена, нужно уделять больше внимания слабым
251;3030;П1.2;17.10.2022;118;879;878;877;0;0;0;20;7;7;6;;11;18;0;;7;10;0;Урок мне очень понравился, учитель работал как с сильными учениками, так и со слабыми учащимися.
252;3032;П1.2;17.10.2022;118;878;879;877;0;0;0;9;1;6;2;;0;0;0;;1;6;2;
253;2397;П1.2;18.10.2022;118;876;875;874;0;4;1;0;13;8;2;;15;9;10;;13;8;2;Работой удовлетворена. Все обучающиеся в классе были охвачены вниманием учителя.Считаю, что изменения не нужны.
254;2605;П1.2;18.10.2022;112;784;936;777;0;4;2;29;10;12;6;;44;34;6;;8;12;5;Удовлетворена. Важно продолжать начатую работу со средними и слабыми учениками.
255;2457;П1.2;18.10.2022;79;533;950;532;1;4;2;6;2;3;1;;3;5;1;;2;3;1;Распределил своё внимание  между тремя группами  равномерно. Все обучающиеся были задействованы. Считаю, что цель достигнута. Уроком удовлетворён.
256;2458;П1.2;18.10.2022;79;950;533;532;2;4;1;7;2;4;1;;4;7;1;;2;4;1;Был проведён урок литературного чтения. Да, занятием я удовлетворена. Распределение внимания  между группами было равномерное. Все обучающиеся были задействованы в учебной деятельности. Цель урока достигнута.
257;2285;П1.2;22.10.2022;68;515;514;513;0;0;0;20;5;9;6;;20;23;9;;5;9;6;Да, удовлетворена. Каждый ученик на уроке взаимодействовал с учителем. Цель- обеспечить наибольшую вовлеченность слабых обучающихся.
258;2400;П1.2;24.10.2022;118;873;872;874;0;4;1;0;6;6;7;;13;8;10;;6;6;6;Работой удовлетворена. Вниманием учителя охвачены практически все ученики, как сильные, так и слабые.
259;2403;П1.2;25.10.2022;118;869;870;868;9;3;3;0;5;10;7;;11;10;8;;5;6;4;"Работой удовлетворена.Старалась работать на уроке со всеми котегориями детей. Но всё же сильные отвечали чаще, чем другие. Постараюсь всё же распределять внимание более равномерно. Необходимо подбирать разноуровневые задания, доступные для ""слабых""."
260;2399;П1.2;26.10.2022;118;872;873;874;0;4;1;0;6;5;7;;14;9;7;;6;5;6;Работой удовлетворена. Изменять ничего не надо, практически все ученики охвачены вниманием учителя, как слабые, так и сильные.
261;2466;П1.2;26.10.2022;83;947;561;560;2;3;3;0;1;0;2;;2;0;2;;1;0;2;"В целом, уроком удовлетворена. В структуре урока ничего бы не меняла. Но, думаю, нужно больше уделять внимания слабым ученикам. Для этого в будущем выберу их ""мишенями""."
262;2279;П1.2;26.10.2022;68;517;518;516;2;4;1;0;3;10;13;;10;39;50;;3;10;13;Рузультатом удовлетворена полностью. Внимание  распределено равномерно между успевающеми и слабыми учениками. 
263;2363;П1.2;27.10.2022;133;729;726;727;2;4;1;0;5;5;2;;10;15;8;;5;5;2;Урок прошёл хорошо. Учитель взаимодействовал со всеми учениками. Работал весь класс. Проявили интерес к уроку даже слабые учащиеся. Перед собой хотим поставить следующую цель: использовать и практиковать более усложненные протоколы.
264;2411;П1.2;27.10.2022;118;867;940;865;6;3;3;0;8;13;5;;11;18;0;;7;10;0;Работа с дисциплиной на уроке: учащиеся не могут работать самостоятельно, только при постоянном контроле учителя. В начале следующего урока рассказать о правилах  поведения на уроке  и напоминать об этом каждый урок.
265;2412;П1.2;28.10.2022;118;940;867;865;6;3;3;0;4;4;3;;16;32;9;;4;4;2;Уроком довольна, проблема с выкриками на уроке, что нарушает порядок на уроке. Обратить внимание учеников на правила ответа на уроке и требовать их выполнения
