;prot_id;template_code;date_of_lesson;org_id;teacher_id;observer_id;curator_id;class;satisfaction;wish_to_change;pupils_all;pupils_strong;pupils_middle;pupils_weak;interactions_all;interactions_strong;interactions_middle;interactions_weak;attention_all;attention_strong;attention_middle;attention_weak;teacher_comments
68;775;П1.2;03.03.2022;126;898;897;893;0;0;0;13;6;3;4;;0;0;0;;6;3;4;Да, удовлетворена.Нужно больше привлекать внимание слабым ученикам, чтобы они не были растерянными и напряженными.
69;781;П1.2;03.03.2022;126;897;898;893;0;0;0;8;3;4;1;;0;0;0;;3;4;1;да, удовлетворена. Нужно акцентрировать внимание отвлекающихся. Цель: чтоб дети не отвлекались во время урока. Понимаю, заинтересовать- задания облегченного уровня: создать ситуацию успеха. 
70;270;П1.2;03.03.2022;78;557;556;553;0;0;0;6;2;3;1;;16;22;6;;2;3;1;"Рассмотреть навык ""Распределение внимания учителя"" на ""прицельном"" уровне, чтобы выбрать ""мишень""."
71;1125;П1.2;03.03.2022;103;807;808;809;0;0;0;10;2;2;6;;0;0;0;;2;2;6;Нет, использовать групповые   формы работы
72;649;П1.2;03.03.2022;113;830;829;828;0;0;0;5;0;4;1;;0;0;0;;0;4;1;При подведении итогов урока можно сделать вывод, что все поставленные цели и задачи удалось реализовать так как дети познакомились с рассказом, обсудили темы, затронутые в нем, захотели прочитать произведение полностью.
73;658;П1.2;03.03.2022;113;829;830;828;0;0;0;9;4;4;1;;0;0;0;;4;4;1;Подготовка к урокуна высоком уровне. Цели урока четко определены. Ученики хорошо владеют способами учебной деятельности: высказывают суждения, анализируют, делают выводы. 
74;729;П1.2;03.03.2022;106;691;692;693;0;0;0;4;2;0;2;;12;0;5;;2;0;2;Внимание учителя к обучающимся распределяется равномерно. В работу на уроке вовлечены все.    Сосредоточить внимание на работе в малых группах.
75;226;П1.2;03.03.2022;70;493;494;492;0;0;0;2;1;0;1;;8;0;11;;1;0;1;"Тема  урока ""Три склонения имён существительных"".  В 5 классе два ученика, один из них с ОВЗ (ЗПР).  Своим уроком удовлетворена. Удалось активизировать работу на уроке слабого ученика. Он с большим интересом приходит на урок , работает на уроке и при самооценивании своей работы на уроке ставит себе ""хорошую"" оценку. Цель, которую я ставлю себе: добиваться монологического ответа от сильного и слабого ученика в классе."
76;63;П1.2;04.03.2022;1;661;662;660;0;0;0;13;4;2;7;;7;4;4;;4;2;3;Удовлетворена, менять ничего не нужно. Цели достигнуты.
77;66;П1.2;04.03.2022;1;662;661;660;0;0;0;6;2;2;2;;0;0;0;;2;2;2;Удовлетворена, цель достигнута, задачи выполнены.
78;1027;П1.2;04.03.2022;124;914;915;913;0;0;0;6;0;2;4;;0;16;32;;0;2;4;Миликова Л.Б.: Я достаточно удовлетворена проведенным уроком.В зоне внимания были все ученики (маленькая наполняемость класса).Перед собой ставила цель - вовлечь в работу учеников из каждой группы , цель достигнута. Для достижения цели использовала разные формы работы на уроке: парную, индивидуальную, групповую  раздаточный иллюстр. материал.  привлечение внимание через разные каналы восприятия. Хочется активизировать на уроке отдельных учеников, обратную связь с которыми удалось достичь не полном объеме.Большую ответственностьпри групповой и парной работе возложить на пассивных учеников из обеих групп.
79;266;П1.2;04.03.2022;78;555;558;554;0;0;0;3;0;2;1;;0;0;0;;0;2;1;Я удовлетворена уроком. На уроке учитель у делял внимание равномерно. Дети изготовили макет, работали в группах.
80;821;П1.2;04.03.2022;118;875;876;874;0;0;0;12;6;3;3;;0;0;0;;6;3;3;Сгруппировать слабых учеников с более сильными.
81;883;П1.2;04.03.2022;123;838;839;837;0;0;0;13;3;5;5;;0;0;0;;3;5;5;Результатом удовлетворены
82;890;П1.2;04.03.2022;123;839;838;837;0;0;0;7;0;3;3;;0;0;0;;0;3;3;Результатом удовлетворены
83;1693;П1.2;04.03.2022;103;808;807;809;0;0;0;10;3;7;0;;0;0;0;;3;7;0;нет
84;1490;П1.2;04.03.2022;125;844;932;840;0;0;0;13;2;6;5;;0;0;0;;1;5;4;Результатами встречи я удовлетворена. Не все дети были охвачены вниманием. Поэтому надо больше применять технологий и разноуровневых заданий. Таким образом постараюсь достичь сто процентного охвата детей.
85;1021;П1.2;04.03.2022;124;915;914;913;0;0;0;7;1;1;5;;6;6;39;;1;1;5;Кузнецова А.К.: Уроком удовлетворена.Все ребята на уроке работали - поставленная цель была достигнута.
86;763;П1.2;05.03.2022;126;895;896;894;0;0;0;15;4;3;8;;0;0;0;;4;3;8;
87;769;П1.2;05.03.2022;126;896;895;894;0;0;0;20;12;5;3;;0;0;0;;11;5;2;На уроке были в зоне внимания почти весь класс. Желательно, чтобы слабые ученики были более активными.
88;268;П1.2;05.03.2022;78;558;555;554;0;0;0;7;1;4;2;;0;0;0;;1;4;2;Ведением урока удовлетворена в полной мере.Цель- взаимодействие и уделение внимание учителя классу.
89;559;П1.2;09.03.2022;107;697;695;696;0;0;0;7;2;3;2;;22;42;25;;2;3;2;Да, увеличить количество взаимодействий с сильными учениками. Цель: перевести учащихся из слабой группы с в среднюю и далее.
90;563;П1.2;09.03.2022;107;695;697;696;0;0;0;7;1;3;3;;3;21;20;;0;2;3;Уроком удовлетворена. При анализе протокола выяснилось, что проблема дискриминации не в отношении слабых а сильной группы учащихся. Поставили цель: продумать формы взаимодействия с сильным учащимся, Еву ( средняя группа) включить в зону внимания педагога.
91;600;П1.2;09.03.2022;89;614;613;612;0;0;0;5;1;1;3;;0;0;0;;1;1;3;Уроком удовлетворена.Предлагаю ввести в план урока больше практических заданий для обучающихся.Целью для себя ставлю: использовать больше раздаточного материала, вовлекать обучающихся в саморстогятельную деятельность.
92;617;П1.2;09.03.2022;71;474;472;471;0;0;0;9;3;3;3;;0;0;0;;3;3;2;На уроке не все учащиеся были в зоне внимания. Работала с теми, кто поднимал руку. Цель: выделить мишени, это двое обучающихся и создавать ситуацию успеха для каждого ученика (можно похвалить тех, кто редко отвечает, отметить успех, посмотреть выполнение задания в тетради). Для достижения цели продумаю дифференцированные задания.
93;1085;П1.2;10.03.2022;102;657;656;658;0;0;0;2;1;0;1;;6;0;8;;1;0;1;Удовлетворение есть .Но думаю  надо немного больше распределить внимание на слабого ученика.Хотя сильный ученик сам отвечает, а слабый повторяет.Надо что то доработать .Пока не могу понять что конкретно.
94;837;П1.2;10.03.2022;105;670;671;672;0;0;0;9;1;4;4;;4;19;20;;1;4;4;смогла учесть опыт с прощлого урока, касаемый учеников , нарушающих дисциплину. Было дано больше индивидуальных заданий, не забывала про похвалу. Результат:улучшилась дисциплина, сократилось количество замечаний. Необходимо продолжать рационально распределять  внимание, для эффективной и результативной работы. 
95;613;П1.2;10.03.2022;71;472;474;471;0;0;0;10;2;4;4;;0;0;0;;2;4;4;На уроке все учащиеся были в зоне внимания. Но есть те, кто не сразу отвечал на вопросы, терялся. Цель: выделить мишени, это двое обучающихся и создавать ситуацию успеха для каждого ученика, продолжить формировать уверенность при ответах. Для достижения цели продумаю дифференцированные задания.
96;117;П1.2;10.03.2022;122;921;922;920;0;0;0;9;2;5;2;;0;0;0;;2;5;2;Уроком в целом удовлетворена. В будущем нужно добиваться более активной работы на уроке слабых учеников.
97;128;П1.2;10.03.2022;127;928;929;927;0;0;0;3;1;2;0;;10;16;0;;1;2;0;Уроком удовлетворена. Внимание было распеределено равномерно. Сильному учащимуся было оказано больше внимания потому, что на него можно опереться при изучении нового материавла. На следующих уроках постараться распределить внимание равномерно среди учащихся.
98;136;П1.2;10.03.2022;127;929;928;927;0;0;0;7;2;3;2;;24;26;16;;2;3;2;Уроеом удовлетворена. Распределение ивнимания было равномерным между группами учащихся. Сильные дети были задействоываны в большей степени т.к. на их знания можно оперется при изучении нового м атериала. А средним и слабыем учащимся  внимания оказано одинаково. В дальнейшей работе постараться привлечь к уроку в большей степени средних и слабых детей.
99;216;П1.2;10.03.2022;105;671;670;672;0;0;0;9;3;3;3;;10;13;12;;3;3;3;Учитель старался уделять внимания всем детям в равной доле, но ,на мой взгляд, слабым нужно уделять немного больше внимания. Для того, чтобы активизировать их деятельность, необходимо больше хвалить их, это служит некой мотивацией.
100;1082;П1.2;11.03.2022;102;656;657;658;0;0;0;2;0;1;1;;0;6;9;;0;1;1;В целом удовлетворенна. Может быть тема урока была немного сложновата и поэтому внимание было распределено не равномерно.
101;899;П1.2;11.03.2022;123;836;835;834;0;0;0;15;7;4;4;;0;0;0;;7;4;4;Удовлетворена. Распределение внимания было равномерным. Каждый ученик задействован в работе. Цель0 продолжать котролировать себя при распределении внимания учителя.
102;1668;П1.2;11.03.2022;79;535;536;531;0;0;0;6;1;3;2;;0;0;0;;1;3;2;В целом проведённым уроком и отработанной компетенцией удовлетворена. Считаю, что для ребёнка, которому было уделено мало внимания нужно приготовить опережающее задание для развития коммуникативных УУД в виде сообщения, имеющее предметную направленность. Использовать метод поощрения. Цель:  отработать данную компетенцию в контексте прицельного протокола. Для достижения необходимо применение технологии и методов обучения детей
103;679;П1.2;11.03.2022;108;711;710;709;0;0;0;27;5;12;10;;0;0;0;;5;6;6;Необходимо акцентировать внимание на слабоуспевающих учениках и учениках среднего звена. Увеличить время работы с данной категорией обучающихся. Использовать индивидуальные карточки-задания для слабоуспевающих учеников.
104;710;П1.2;11.03.2022;110;717;718;716;0;0;0;17;2;6;9;;0;0;0;;1;4;7;Работой удовлетворена не в полной степени, хотелось бы выстроить свою работу таким образом, чтобы охватить вниманием большее кол-во учащихся.
105;706;П1.2;13.03.2022;110;718;717;716;0;0;0;22;12;5;5;;0;0;0;;1;3;4;Удовлетворена работой, однако нужно использовать различные формы и методы работы уделяя больше внимания слабым ученикам.
106;830;П1.2;14.03.2022;86;589;590;588;0;0;0;14;7;4;3;;0;0;0;;7;4;3;Достижимая цель повысить уровень знаний каждой группы учеников.
107;552;П1.2;14.03.2022;117;771;770;773;0;0;0;29;9;5;15;;0;0;0;;5;2;4;Конечно, больше охватывать детей на рефлексии. Но я думаю, единственное, что играет очень большую роль - это то, что большая численность детей в классе и за 40 минут просто не хватает времени охватить весь класс.
108;56;П1.2;14.03.2022;120;890;889;888;0;0;0;21;7;7;7;;9;6;10;;6;5;5;Дети были пассивны, к уроку не готовы, отвечали не всегда верно, буду продолжать работать над охватом обучающихся.
109;120;П1.2;14.03.2022;122;922;921;920;0;0;0;9;2;5;2;;0;0;0;;2;5;2;Уроком удовлетворена. Учитель уделил внимание всем учащимся.
110;1034;П1.2;15.03.2022;124;917;916;918;0;0;0;3;1;0;2;;15;0;30;;1;0;2;Голонягина Л.А.: Пока ничего менять не надо. Все дети были вовлечены в работу. Внимание распределено равномерно. Уровнем сформированности данной компетенцией удовлетворена полностью.
111;59;П1.2;15.03.2022;120;889;890;888;0;0;0;15;3;9;3;;6;19;7;;3;9;3;"Уроком удовлетворена, прошел в хорошем темпе, все дети охвачены вниманием. Из протокола видно, что взаимодействие со ""средними""  детьми было больше всего. "
112;1118;П1.2;15.03.2022;124;916;917;918;0;0;0;6;2;2;2;;18;28;34;;2;2;2;Швец Л.Д.: Удовлетворена уровнем распределения внимания среди учащихся. Но есть необходимость использования на уроках большего количества наглядного материала, для привлечения учащихся к работе на уроке.     
113;984;П1.2;15.03.2022;88;576;577;575;0;0;0;5;0;2;3;;0;0;0;;0;2;3;Учитель на уроке взаимодействовал со всеми учениками. При изучении новой темы старалась отвечать на все вопросы ребят. По моему мнению нужно больше внимания уделять слабым ученикам.
114;74;П1.2;16.03.2022;1;664;665;663;0;0;0;11;4;5;2;;37;37;25;;4;3;2;Распределением внимания не совсем удовлетворена, так как на выполнение практических заданий у средних и слабых учеников ушло больше времени, чем запланировала. На следующих уроках необходимо скорректировать задания для этих детей.
115;554;П1.2;16.03.2022;117;770;771;773;0;0;0;9;3;2;4;;0;0;0;;3;2;4;Урок проходил на достойном уровне. Учителем были соблюдены все этапы по ФГОС. Единственное, была очень маленькая мотивация на происходящую деятельность.
116;557;П1.2;16.03.2022;117;772;774;769;0;0;0;22;8;8;6;;0;0;0;;8;8;6;"Да, удовлетрорительно. Считаю, что нужно применять на уроке более активные приемы для опроса ребят по теме. Например: ""А сейчас ответит тот,кто выше всех в классе."" . Такие приемы позволяют вести активную деятельность в классе всем ребятам. Бонус- такие приемы хорошо работают на сплочение класса, так как ребята узнают больше друг про друга."
117;1686;П1.2;16.03.2022;109;704;703;702;0;0;0;27;10;13;4;;15;12;11;;8;9;4;"Да, удовлетворена. Есть однозначный прогресс между двумя наблюдениями: в зоне моего внимания было больше учеников. Хотелось бы минимизировать ""слепые"" зоны."
118;1687;П1.2;16.03.2022;109;703;704;702;0;0;0;32;15;10;7;;29;17;15;;14;11;7;"Сделала вывод, что из зоны внимание чаще всего выпадают средние ученики, в основном дети- ""интроверты"", ""тихони"". Необходимо сосредоточить большее количество внимания на них"
119;675;П1.2;16.03.2022;108;710;711;709;0;0;0;29;12;12;5;;0;0;0;;10;10;3;Результатом удовлетворена, т.к. увеличился процент охвата включенных в работу учеников. В работу вовлечены все категории обучающихся. Для слабоуспевающих учащихся подготовлены индивидуальные карточки. На слудующем уроке планируется организовать работу в парах.. 
120;42;П1.2;17.03.2022;120;883;884;882;0;0;0;24;5;9;9;;9;19;14;;5;9;9;"уроком удовлетворена, дети подготовились к уроку, работали, большее внимание уделяла ""средним"" и ""слабым"" детям"
121;53;П1.2;17.03.2022;120;887;886;885;0;0;0;16;5;4;7;;9;6;8;;4;3;3;Мне казалось, что на уроке охватила вниманием всех детей, но из протокола вижу, что 3 обучающихся выпали из моего поля зрения. На следующем этапе построю урок так, чтобы задействовать в работе всех.
122;689;П1.2;17.03.2022;80;546;547;542;0;0;0;10;5;0;5;;3;0;1;;3;0;1;Большая часть чащихся вне поля зрения учителя.Охватывать вниманием всех учащихся. Для этого опрашивать по цепочке, например.
123;691;П1.2;17.03.2022;80;547;546;542;0;0;0;12;4;4;4;;13;7;7;;4;4;4;Учитель деляет внимание всем ченикам, но делает это не равномерно.Нжно стремиться не по 1 разу за рок. Для этого можно один вопрос аадресовать 2-3 ченикам, а потом оценивать.
124;982;П1.2;17.03.2022;88;577;576;575;0;0;0;5;0;2;3;;0;0;0;;0;2;3;Педагог на уроке уделяла внимание всем обучающимся. Большую часть времени работала со слабыми учениками по закреплению пройденной темы. В целом педагог показала хорошую работу с классом.
125;158;П1.2;18.03.2022;86;590;589;588;0;0;0;14;5;6;3;;0;0;0;;5;6;3;Уроком удовлетворена,но хочу повысить уровень знаний слабых учеников.Для достижения цели, использую прицельный протокол.
126;45;П1.2;18.03.2022;120;884;883;882;0;0;0;21;3;9;9;;5;20;20;;3;9;9;уроком удовлетворена, все дети работали на уроке, задавали вопросы, отвечали, выполняли задание в соответствии с инструкцией. Переходим к следующему протоколу.
127;48;П1.2;18.03.2022;120;886;887;885;0;0;0;22;10;8;2;;7;6;2;;7;6;2;Уроком удовлетворен, на следующем уроке постараюсь  охвать всех детей. Продолжим работу с этим же протоколом.
128;601;П1.2;18.03.2022;89;613;614;612;0;0;0;4;1;1;2;;0;0;0;;1;1;2;Уроком удовлетворена. Цель- посмотреть взаимодействие класса и учителя  понять какие изменения в ведении своих уроков я должна внести по отношению к этому классу.
129;223;П1.2;19.03.2022;86;593;592;591;0;0;0;12;4;5;3;;0;0;0;;4;5;3;Да,удовлетворена. Планирую достичь цели, чтобы из групп средней и слабой ученики перешли в сильную. Хочу использовать прицельный протокол.
130;987;П1.2;21.03.2022;104;617;618;616;0;0;0;6;2;3;1;;4;3;2;;2;3;1;Анализируя свой урок можно сказать, что внимание моей работы было таково, что в ходе работы один ученик выпал из поля зрения, и включался в работу эпизодически, только после подхода к нему. Работа с сильными ребятами немного не задалась, приходилось тратить время на объяснение из прошлого материала, так как ребята пришли на урок не совсем подготовленными.
131;221;П1.2;23.03.2022;86;592;593;591;0;0;0;13;4;5;4;;0;0;0;;4;5;4;Удовлетворена результатом урока.Следующий протокол планирую провести прицельный.  
132;1128;П1.2;23.03.2022;73;482;481;480;0;0;0;5;2;2;1;;16;17;18;;2;2;1;Я полностью удовлетворена уроком. Учитель взаимодействовал со всеми учениками. Учащиеся работали активно и с интересом на уроке. Атмосфера была спокойной и дружелюбной. Большое внимание учитель уделял более слабым учащимся. Все этапы урока были соблюдены.
