;prot_id;template_code;date_of_lesson;org_id;teacher_id;observer_id;curator_id;class;satisfaction;wish_to_change;pupils_all;pupils_strong;pupils_middle;pupils_weak;interactions_all;interactions_strong;interactions_middle;interactions_weak;attention_all;attention_strong;attention_middle;attention_weak;teacher_comments
0;1302;П5.1;09.03.2022;128;735;736;734;0;0;0;10;;;;0;;;;8;;;;
1;1300;П5.1;10.03.2022;128;736;735;734;0;0;0;7;;;;0;;;;7;;;;
2;801;П5.1;11.03.2022;100;684;685;686;0;0;0;14;;;;0;;;;14;;;;Уроком удовлетворена Нужно работать над полными ответами детей. Цель моей работы: работать над развитием речи глубже, больше. Работа проводится, но для достижения цели  необходимо применять ряд заданий.
3;802;П5.1;15.03.2022;100;684;685;686;0;0;0;13;;;;0;;;;13;;;;Методикой время речи удовлетворена, т.к. у обучающихся начальной школы наблюдаются низкие показатели связной речи, что не соответствует современным требованиям. Буду в своей практике пользоваться и дальше данной методикой.
4;1705;П5.1;15.03.2022;77;506;505;504;0;0;0;10;;;;0;;;;10;;;;Удовлетворена.  Проанализировать урок по усложненному протоколу.
5;1704;П5.1;17.03.2022;77;505;506;504;0;0;0;13;;;;0;;;;9;;;;Удовлетворена. Нужно увеличивать поцент отвечающих на уроке. Проводить  биц-опрос, опрос по цепочке.
6;1311;П5.1;29.03.2022;112;783;784;777;0;0;0;18;;;;0;;;;11;;;;удовлетворена удовлетворительном уровне
7;1314;П5.1;29.03.2022;112;784;783;777;0;0;0;26;;;;0;;;;15;;;;удовлетворена удовлетворительном уровне
8;101;П5.1;05.04.2022;84;565;566;564;0;0;0;3;;;;0;;;;3;;;;Да,удолетворена.Но думаю,нужно больше спрашивать детей,давать  им время подумать над вопросом.
9;112;П5.1;05.04.2022;84;566;565;564;0;0;0;9;;;;0;;;;9;;;;"Я не удовлетворена. Нужно сделать так, чтобы на уроке большую часть времени говорили сами ученики, а не учитель. Цель: научить ребят выражать свои мысли, размышлять. К большому сожалению, они не умеют говорить! Думаю, что для достижения цели необходимо ""учить их процессу говорения"", развивать речевой аппарат, пополнять словарный запас."
10;196;П5.1;06.04.2022;111;801;802;792;0;0;0;22;;;;0;;;;14;;;;Не совсем удовлетворена результатом, требуется еще уделить внимание времени ответа детей. Для этого определила категории детей, которым необходимо давать больше времени на ответ. Нужно обратить внимание и на количество задаваемых вопросов..
11;203;П5.1;06.04.2022;111;802;801;792;0;0;0;22;;;;0;;;;13;;;;Не совсем удовлетворена резудльтатом. Сложно рассчитать время ответа обучающегося. Необходимо увеличить время наответ для определенной категории детей, попробовать сократить количество вопросов и поработать над содержанием проблемных вопросов.
12;231;П5.1;07.04.2022;70;493;494;492;0;0;0;2;;;;0;;;;2;;;;Ребёнку с ОВЗ нужно больше времени для ответа, он дольше концентрирует своё внимание, чем обычный  ученик. Он медленнее говорит, нескоько раз повторяет одно и то же слово или фразу. Но у него есть желание отвечать, рассуждать, и это похвально. Главное, не отбить это желание.
13;532;П5.1;08.04.2022;133;728;729;727;0;0;0;12;;;;0;;;;8;;;;Да, урок прошёл плодотворно. Используемые формы организации учебной деятельности –  беседа, парная работа, развивается умение работать в паре, приходить к общему мнению, принимать и уважать мнение другого.
14;264;П5.1;12.04.2022;75;498;497;496;0;0;0;1;;;;0;;;;1;;;;обращать внимание на полные и правилные ответы учащихся на поставленные вопросы.  Добиваться активности учащихся при работе на уроках, владением терминалогией по предмету.
15;259;П5.1;14.04.2022;75;497;498;496;0;0;0;5;;;;0;;;;5;;;;Удовлетворина в целом, но буду стремиться к тому чтобы дети более полно отвечали на вопросы и правильно излагали свои мысли. Больше творческих заданий давать не только на уроках, но и внеурочной деятельности, прививать любовь к чтению.
16;627;П5.1;21.04.2022;74;490;489;488;0;0;0;15;;;;0;;;;8;;;;Да, урок прошёл плодотворно. Используемые формы организации учебной деятельности – эвристическая беседа, парная работа по составлению и корректировке плана совместной работы), обсуждение и выбор варианта схемы – логической цепочки были направлены на развитие у детей регулятивных УУД (умение ставить цель, составлять план реализации поставленной цели), коммуникативных УУД (умение работать в паре, приходить к общему мнению, принимать и уважать мнение другого) и учебно-познавательных УУД (умение работать с методическим аппаратом учебника, свёртывать информацию, представлять ее схематичной модельной форме).
17;237;П5.1;22.04.2022;70;494;493;492;0;0;0;2;;;;0;;;;2;;;;Дети на уроке работают, но мальчик активнее. Время его ответов короче, чем время ответов девочки. У неё дефект речи. Она слабее, медлительней, скованней (в силу своих психофизических особенностей).  У неё нет особой заинтересованности. Учитель много работает с ней, вовлекая в работу, подхваливая. Терпеливо добиваются сообща правильных ответов.
18;623;П5.1;26.04.2022;74;489;490;488;0;0;0;13;;;;0;;;;9;;;;Да, урок прошёл плодотворно. Используемые формы организации учебной деятельности –  беседа, парная работа, развивается умение работать в паре, приходить к общему мнению, принимать и уважать мнение другого, умение работать с методическим аппаратом учебника, свёртывать информацию.
19;1497;П5.1;05.05.2022;121;905;906;909;0;0;0;10;;;;0;;;;8;;;;Уроком и работой на нём удовлетворена. Каждый ученик отвечает на поставленные вопросы за комфортное для него время. Стоит обратить внимание ребят на тот факт, что каждый индивидуален, скорости мышления разные, для того чтобы предотвратить ответы за ученика, которому был задан вопрос. 
20;1499;П5.1;13.05.2022;121;907;908;911;0;0;0;8;;;;0;;;;6;;;;Удовлетворена, как достичь цель понимаю.
21;1115;П5.1;16.05.2022;113;826;827;825;0;0;0;8;;;;0;;;;8;;;;Цель урока достигнута. Этапы урока были логически тесно свзаны между собой, чередовались различные виды деятельности. Содержание урока соответствовало поставленной цели. На уроке были использованы упражнения на интерактивной доске. Дети показали хороший уровень усвоения материала.Учебная информация была привлекательна для детей.
22;476;П5.1;16.05.2022;113;830;829;828;0;0;0;5;;;;0;;;;5;;;;На уроке были задействованы все учащиеся, они быстро включились в урок. Урок получился динамичным, но считаю, что на некоторых этапах урока стоило больше времени выделить. В целом урок прошел хорошо. 
23;1605;П5.1;16.05.2022;121;903;904;910;0;0;0;18;;;;0;;;;18;;;;"поднимают руку те ученики, которые знают ответ и говорят очень быстро, даже если он неверный.  Учитель старался охватить весь класс и спрашивал даже тех, кто руку не поднимал, а значит у них время на ответ уходило гораздо больше. Дети в основном давали односложные ответы, учителю нужно приучать к развёрнутым ответам и давать время на размышление детям, у которых трудности. Слабым детям задавать ""наводящие"" вопросы."
24;1116;П5.1;16.05.2022;113;827;826;825;0;0;0;11;;;;0;;;;11;;;;Для достижения цели использовались новые педагогические технологии. Учитель успешно решает поставленные задачи. Учащиеся показали высокий уровень познавательных возможностей. Рекомендации: продолжить индивидуальную работу с пассивными учащимися.
25;1496;П5.1;16.05.2022;121;906;905;909;0;0;0;13;;;;0;;;;11;;;;Я полностью доволен результатми. Хотелось бы распределение времени на уроке сделать более рациональным. На следующем уроке я хочу сделать распределение времени на ответ с учетом индивидуальных когнитивных способностей учеников, чтобы больше времени на обдумывание ответа получили слабые ученики. Я полностью понимаю как достичь этой цели
26;479;П5.1;16.05.2022;113;829;830;828;0;0;0;9;;;;0;;;;9;;;;На уроке царила дружелюбная атмосфера, настроение у детей было жизнерадостное, бодрое. На уроке была дисциплина. В конечном итоге работы цели поставленные перед учителем были достигнуты.
27;1523;П5.1;16.05.2022;129;752;753;757;0;0;0;7;;;;0;;;;7;;;;"Ответы учеников отличаются от однословного до  полного развернутого.Ответы сильных учеников ""затягиваются""  во времени, дети стараются проговорить мысль, приводят примеры и доводы. Слабые ученики отвечают кратко, без приведения дополнительной информации.                                                                       Предлагаю сделать для слабых учеников ""слова- подсказки"", ""опора для ответа"" с помощью которых они смогут строить предложения."
28;1524;П5.1;16.05.2022;129;753;752;757;0;0;0;10;;;;0;;;;7;;;;"Удовлетворена частично. Трое учащихся на уроке не отвечали ни одного раза. Ответы слабых учеников краткие. Сильные ученики отвечали развернутыми ответами, приводили примеры, дополняли ответы друг друга. Уучитель на уроке использовала прием ""слова-подсказки"", ""слова-опора"" для ответа с помощью которых ученики формулировали предложения."
29;1492;П5.1;17.05.2022;76;502;501;500;0;0;0;7;;;;0;;;;7;;;;Удовлетворена не совсем. Нужно больше времени давать на ответы учащимся, но это приведет к тому, что все содержание материала на уроке не будет изучено. Это можно достичь, используя на уроке для ответов алгоритм ответа обучающегося. Цель : отработать алгоритм ответов, довести до автоматизма. Это сэкономит время ответа каждого ученика. Вовлечь педагогов школы к использованию этой схемы к опросу учеников.
30;1493;П5.1;17.05.2022;76;501;502;500;0;0;0;7;;;;0;;;;7;;;;"Не совсем удовлетворена. Требуется намного больше времени для проговаривания ответа учащихся, но это приводит к тому что все содержание материала, может быть не изучено. Цель: ""Отработать"" ответы учащихся при помощи схемы ""Алгоритм ответа на вопрос"", используя ее на всех уроках, вовлечь педагогов школы для использования данной схемы при ответе обучающихся."
31;2138;П5.1;05.09.2022;101;654;954;650;5;3;3;19;;;;14;;;;13;;;;Уроком доволен. Как и предполагал, работали те, кто пришел хорошистами из начальной школы. Цель достигнута не в полной мере.
32;2144;П5.1;07.09.2022;101;954;654;650;7;3;4;17;;;;13;;;;12;;;;Не все отвечали, но заинтересованы были все ребята. Хочу немного изменить подход
33;2174;П5.1;07.09.2022;85;569;570;568;8;2;4;9;;;;26;;;;7;;;;Уроком удовлетворены не в полной мере. Скорее всего это зависит от того, что дети только вышли с летних каникул и не до конца включились в работу. 
34;2173;П5.1;09.09.2022;85;570;569;568;3;1;4;10;;;;11;;;;6;;;;На время стоит изменить форму работы, чтобы дети быстрее включались в работу.
35;2155;П5.1;13.09.2022;99;679;681;682;0;3;2;5;;;;15;;;;5;;;;Уроком я довольна. Дети активно работали. Тема урока не позволила задавать много вопросов. 
36;2158;П5.1;14.09.2022;99;681;679;682;0;3;1;11;;;;28;;;;11;;;;Уроком я довольна. Хочется чтобы все дети отвечели полным ответом, могли доказать правиильность своей позиции.
37;2134;П5.1;14.09.2022;101;652;651;649;4;4;2;18;;;;43;;;;15;;;;Ердякова С.В.: Работой на уроке удовлетворена. Ребята старались работать активно, в свою очередь я постаралась задействовать каждого обучающегося. 
38;2142;П5.1;15.09.2022;101;651;652;649;3;3;2;15;;;;27;;;;12;;;;Постникова С.В.: Уроком в целом удовлетворена. Ребята работали достаточно активно. В свою очередь, я старалась прокомментировать каждый ответ обучающихся. 
39;1818;П5.1;26.09.2022;118;875;876;874;0;4;4;12;;;;26;;;;12;;;;Считаю, что учитель тактично и умело подбирает вопросы детям, учитывая индивидуальные возможности детей. Изменять ничего не надо. 
40;1921;П5.1;26.09.2022;108;707;708;706;0;0;0;24;;;;18;;;;13;;;;Работать над связной речью, проговаривать полным ответом. На следующих уроках эти пункты пытаться поправлять
41;1827;П5.1;27.09.2022;118;876;875;874;0;4;4;22;;;;22;;;;22;;;;Работой удовлетворена. В кратце повторили пройденный материал, ответы детей удовлетворяют: быстро, по делу. Думаю, что время речи детей зависит от сложности материала и, конечно, от индивидуальных возможностей.
42;2587;П5.1;04.10.2022;105;671;670;672;3;4;2;9;;;;17;;;;9;;;;Уроком удовлетворена. Каждый ученик имел возможность ответить на уроке и поучаствовать в дискуссии.
43;2332;П5.1;04.10.2022;129;759;758;751;0;0;0;7;;;;0;;;;0;;;;Результатами удовлетворена частично, так как 100% учащихся на уроке отвечали, но среднее время затраченное на ответы каждым учеником составляет всего 1,5 минуты, что считаю недостаточным для развития речи учащихся. Следует, больше задавать вопросов на уроке и требовать от учеников  полные ответы.
44;2588;П5.1;04.10.2022;105;670;671;672;8;3;3;3;;;;8;;;;3;;;;Уроком в целом удовлетворена. Каждый ученик имел возможность ответить на уроке. Следует обратить внимание на то, чтобы ученики давали более развёрнутые ответы на вопросы.
45;2333;П5.1;04.10.2022;129;756;755;754;0;4;0;9;;;;46;;;;8;;;;Уроком удовлетворен. Обратная связь с обучающимися прослеживалась. На данном уроке работали активно.
46;2519;П5.1;04.10.2022;95;606;607;605;7;3;3;3;;;;16;;;;3;;;;Удовлетворена. Были некоторые недочеты, но ответы были в основном полными, что очень порадовало.
47;2523;П5.1;04.10.2022;95;607;606;605;6;3;3;4;;;;20;;;;4;;;;Урок эффективен по уровню получаемых знаний, умений навыков и способов деятельности на достаточном уровне.Удовлетворена. Ответы были в основном полными..
48;2331;П5.1;05.10.2022;129;758;759;751;0;0;0;11;;;;0;;;;0;;;;Результатами удовлеторена. Все дети на уроке работали, отвечали на поставленые вопросы. Большее время на уроке (2,55 мин * 11 уч = 28 мин) отвечали ученики.
49;2280;П5.1;05.10.2022;68;517;518;516;2;3;3;23;;;;54;;;;23;;;;Результатом в целом удовлетворена. Обучающимся необходимо разное время для высказывания ответа на вопрос. Более сильные отвечают дольше пытаються дать развёрнутый ответ, но иногда не сосем верно.  Более слабые обучающиеся отвечают односложно. Таким ребятам надо задавать дополнительные вопросы, что бы вывести их на развернутый ответ Цель подвести детей к более развернутому ответу, а для этого надо задавать навадящие вопросы и давать время на обдумывание. 
50;2334;П5.1;06.10.2022;129;755;756;754;0;4;0;12;;;;44;;;;9;;;;"Думаю, что цель урока была достигнута, среднее время потраченое учащимися на ответ 4,4 сек. - это норма, так как урок проходил в 1 классе и тема урока была ""Закрепление изученного"""
51;2628;П5.1;06.10.2022;111;802;795;792;0;4;2;14;;;;0;;;;0;;;;Уроком удовлетворена. Все ребята активно отвечали, никто не остался незамеченным.
52;2207;П5.1;06.10.2022;126;896;895;894;6;3;3;19;;;;54;;;;19;;;;Уроком удовлетворена.Довольна тем, как отвечали дети.Урок, считаю был продуктивным, благодаря правильно подобранным вопросам. К каждому ребёнку был индивидуальный подход.Думаю продолжать работу в том же духе.
53;2276;П5.1;06.10.2022;68;518;517;516;2;4;1;21;;;;85;;;;21;;;;Уроков удовлетворена. Ребятам дается определенное время  для размышления, поэтому достижимая цель учителя  была достигнута. 
54;2631;П5.1;06.10.2022;111;796;802;792;0;3;0;19;;;;0;;;;19;;;;Удовлетворена результатом урока. Возможность ответить получили все, больше внимания нужно будет уделить построению ответов слабых учеников.
55;2530;П5.1;07.10.2022;97;959;628;627;9;2;4;2;;;;17;;;;2;;;;"Я не совсем удовлетворена. Один из учеников  был чем-то отвлечен, невнимательно слушал и мешкал с ответами, и ответы были немногословны, в основном кратки .Этот ребенок из проблемной семьи, у подростка часто бывает плохое настроение. Постараюсь ""разговорить ""его в добрую минуту. Второй ученик работал получше, "" вытягивал ""нить разговора на уроке, но на некоторые воросы думал минуты по 3. Этот ребенок  пропустил несколько уроков из-за болезни. Класс со средними реальными возможностями. "
56;2205;П5.1;07.10.2022;126;898;897;893;11;4;2;13;;;;20;;;;13;;;; старалась на уроках   развивать речь учащихся, поэтому наряду с репродуктивными ответами  вызывает учащихся на размышления. Поэтому рада продолжительным ответам. Для этого старалась  правильно формулировать вопрос. Хотелось бы больше времени уделять таким ответам. К сожалению , не всегда это получается.
